objectid,filename,youtubeid,vimeoid,title,creator,date,description,subject,location,latitude,longitude,source,identifier,type,format,language,rights,rightsstatement
birthright-2024,birthright-2024.jpg,,,Birthright: A Vision into the Plight of Southeastern Indigenous Culture through the Eyes of Guernica,John Henry Gloyne,2024,"A ""remix of Picassos Guernica"" that ""depicts the horrors of colonialism and mound desecration from a Cherokee perspective.""",Cherokee;animals;death;mound,"Eastern Band Territory, Cherokee, NC",35.47694,83.32028,McClung Museum,2024.12.1,Image;StillImage,image/jpeg,,,
jar-1958,jar-1958.jpg,,,Jar,Unknown,1662,A porcelain jar from the Kangxi era (1662-1722) containing European bronze mounts.,vase;porcelain,China,35.8593,104.1361,McClung Museum,1958.5.186,Image;PhysicalObject,image/jpeg,,,
pine_needle_basket,pine_needle_basket.jpeg,,,Choiyi Hissi Asaala (Coushatta Longleaf Pine Needle Basket),Landon Riley Heath Diagle,2020,"A woven, dual shaded, pineneedle basket with top, featuring  pinecones and dyed raffia embedded in its top.",basket;Coushatta;traditional;weaving,"Koasati Territory, Elton, LA",30.505,93.685,McClung Museum,2024.3.1,Image;PhysicalObject,image/jpeg,,,
sun_dances,sun_dances_1.jpeg,,,The Sun Dances Around the People,Vivian Garner Cottrell,2018,"A dual-toned, open topped basket decorated with traditional designs, including those of the sun, made of doublewoven rivercane.",basket;Cherokee;weaving;décor,"Kansas, OK",36.2025,94.795,McClung Museum,2024.2.1,Image;PhysicalObject,image/jpeg,,,
days_past,days_past.jpeg,,,Days Past,Aaron Lambert,2023,"A painting depicting a sacred mound surrounding by residential dwellings, alongside a river in the midst of the mountains of Western North Carolina. ",painting;Cherokee;WesternNC;river;mound;village,"Eastern Band Territory, Cherokee, NC",35.47694,83.32028,McClung Museum,2024.9.1,Image;StillImage,image/jpeg,,,
